id,id_user,titre,description
1,1,"Découverte de la Science","Testez vos connaissances scientifiques avec ce quiz passionnant !"
2,1,"Histoire du Monde","Explorez les événements marquants de l'histoire mondiale avec ce quiz."
3,1,"UEFA Champions League","Testez vos connaissances sur l'UEFA Champions League."
4,1,"DBZ","Quiz passionnant sur Dragon Ball Z."
5,1,"Espace","Explorez l'univers avec ce quiz sur l'espace."
6,1,"Cinéma","Testez vos connaissances sur le cinéma et les films célèbres."
7,1,"Logo","Quiz sur les slogos de marquespopulaires."
8,1,"Géographie","Testez vos connaissances géographiques avec ce quiz divertissant."
9,1,"Animaux","Explorez le règne animal avec ce quiz sur les animaux du monde."
